{
  "run_id": "a1b2c3d4e5f6",
  "variant": "attack_defense_v2",
  "data_range": "2024-01-01/2025-12-31",
  "params": {
    "lookback": 20,
    "atr_period": 14,
    "tp_atr_mult": 3.0,
    "sl_atr_mult": 1.5,
    "position_fraction": 0.3,
    "max_hold_bars": 60
  },
  "metrics": {
    "avg_sharpe": 1.23,
    "avg_return": 0.45,
    "avg_max_dd": 0.18,
    "symbols_tested": 5,
    "total_trades": 342,
    "win_rate": 0.56,
    "profit_factor": 1.4
  },
  "validation": {
    "gates": [
      {
        "gate": "OOS",
        "passed": true,
        "metrics": {"avg_sharpe": 1.1, "avg_return": 0.35},
        "thresholds": {"min_sharpe": 0.5, "min_return": 0}
      },
      {
        "gate": "WF",
        "passed": true,
        "metrics": {"profitable_pct": 0.7, "mean_sharpe": 0.95},
        "thresholds": {"min_profitable_pct": 0.6}
      },
      {
        "gate": "MC-CI",
        "passed": true,
        "metrics": {"sharpe_degradation_pct": 25, "survival_rate": 0.85},
        "thresholds": {"max_sharpe_degradation_pct": 40}
      }
    ],
    "all_passed": true
  },
  "risk": {
    "max_dd": 0.18,
    "sharpe": 1.23,
    "calmar": 2.5
  },
  "paths": {
    "backtest_log": "output/research/a1b2c3d4e5f6_backtest.json",
    "equity_curve": "output/research/a1b2c3d4e5f6_equity.png"
  },
  "decision": "approved"
}
